1,Данная онлайн-собственность использует cookies. Сookies позволяют пользователям перемещаться 
2,по онлайн-собственности, такой как веб-сайты, а также позволяют нам совершенствовать 
3,содержание, маркетинг и улучшать пользовательский опыт. Более подробную информацию о 
4,cookies, в том числе о том, как их отключить, ищите в разделе cookies настоящей Политики 
5,конфиденциальности. Пожалуйста, обратите внимание, что при отключенных cookies мы не 
6,можем гарантировать, что данная онлайн-собственность и ваш опыт во время ее посещения будут 
7,такими, как предполагалось. Используя данную онлайн-собственность, вы соглашаетесь, и мы 
8,будем считать это согласием, получать cookies, если только вы не откажетесь от получения 
9,cookies в настройках, как изложено в разделе cookies настоящей Политики конфиденциальности.
10,
11,Добро пожаловать! Ниже вы найдете Политику конфиденциальности Activision. Настоящая 
12,Политика конфиденциальности была в последний раз обновлена 28 сентября 2012 года.
13,Ваша конфиденциальность – наша политика. 
14,ОСНОВНЫЕ ПОЛОЖЕНИЯ
15,Используя данный веб-сайт, приложения для мобильного телефона или планшета или другую 
16,онлайн-собственность Activision, вы подтверждаете, что прочитали и согласны с Политикой 
17,конфиденциальности, изложенной ниже, включая осуществление Activision следующих действий:
18,
19,
20,• сбор, обработку и использование демографической информации обо мне, такой как 
21,мой возраст, пол, интересы и IP-адрес, который я использую, чтобы в сочетании с 
22,моей личной информацией использовать ее для аналитических и маркетинговых 
23,целей;
24,
25,• периодическую связь со мной по электронной почте с целью узнать мое мнение и 
26,пригласить меня к участию в онлайн-опросах и исследованиях, добавление 
27,предоставляемой мной информации к моей личной информации и использование этой 
28,информации для маркетинговых целей;
29,
30,• использование веб-маяков (или прозрачных GIF) на своем веб-сайте или в 
31,сообщениях электронной почты, или размещение собственных cookies и cookies 
32,третьих сторон на моем компьютере или устройстве, или использование флеш-
33,технологии при необходимости с целью адаптировать сервис к моим интересам и 
34,выбрать объявления и продукты, наиболее интересные для меня; 
35,
36,• разглашение моей личной информации дочерним предприятиям Activision и 
37,находящимся в полной собственности компаниям группы;
38,
39,• сбор, обработку и хранение личной информации, которую я предоставляю на 
40,серверах в Соединенных Штатах Америки или других странах, где Activision или ее 
41,филиалы, дочерние компании, агенты или поставщики имеют свои мощности или 
42,бизнес-операции; в некоторых странах уровень защиты данных может быть ниже, 
43,чем в Европейском Союзе, но Activision будет принимать разумные меры для защиты 
44,моего права на конфиденциальность в соответствии с применимыми законами о 
45,защите данных.
46,
47,ОНЛАЙН-ПОЛИТИКА КОНФИДЕНЦИАЛЬНОСТИ ACTIVISION 
48,Являясь одним из крупнейших в мире поставщиков интерактивного развлекательного 
49,программного обеспечения, Activision стремится предоставить лучшие онлайн-развлечения в 
50,безопасной онлайн-среде.
51,Activision Publishing, Inc (включая находящиеся в ее полной собственности дочерние 
52,предприятия) («Activision») уважает право наших онлайн-посетителей на конфиденциальность. 
53,Мы приняли настоящую Политику конфиденциальности, чтобы объяснить, как мы собираем, 
54,храним и используем информацию, которую вы предоставляете нам онлайн.
55,Используя данный веб-сайт, приложение для мобильного телефона или планшета или другой 
56,онлайн-продукт или услугу, предоставляемые вам Activision (вместе именуемые «веб-сайт и/или 
57,другая онлайн-собственность»), вы выражаете свое согласие с Политикой конфиденциальности 
58,Activision. Если вы не согласны с настоящей Политикой конфиденциальности, пожалуйста, не 
59,используйте данный веб-сайт или другую онлайн-собственность. Мы оставляем за собой право 
60,вносить изменения в настоящую Политику конфиденциальности, поэтому, пожалуйста, 
61,проверяйте время от времени, чтобы быть в курсе любых изменений. При внесении 
62,существенных изменений в настоящую Политику конфиденциальности мы будем публиковать 
63,уведомление об изменении на www.activision.com, а также в настоящей Политике 
64,конфиденциальности. Ваше дальнейшее использование нашего веб-сайта или другой онлайн-
65,собственности будет означать ваше согласие с этими изменениями. Если вы не согласны с любым 
66,из этих изменений, пожалуйста, не продолжайте использование данного веб-сайта или другой 
67,онлайн-собственности. Настоящая Политика конфиденциальности является частью условий, 
68,регулирующих использование данного веб-сайта или другой онлайн-собственности.
69,Настоящая Политика конфиденциальности и знак сертификации, расположенный справа от вас, 
70,подтверждают, что Activision имеет действующую лицензию и является участником программы 
71,онлайн-конфиденциальности Совета по рейтингам развлекательного программного обеспечения 
72,(«ESRB»): «ESRB онлайн-конфиденциальность». С целью защитить вашу конфиденциальность мы 
73,добровольно взяли на себя эту инициативу относительно конфиденциальности, и Activision была 
74,оценена и сертифицирована по программе «ESRB онлайн-конфиденциальность» как 
75,удовлетворяющая установленным практикам онлайн-сбора и использования информации. В 
76,рамках этой программы конфиденциальности мы часто подвергаемся аудиту сайта и другим 
77,механизмам проверки и контроля, применяемым независимо ESRB.
78,Всякий раз, посещая веб-сайт, на котором отображен знак сертификации программы «ESRB 
79,онлайн-конфиденциальность», вы можете рассчитывать на уведомление о следующем:
80,* использует ли компания cookies, отслеживает ли IP-адреса или использует другие пассивные 
81,средства сбора информации; 
82,* собирает ли кто-то вашу личную информацию, если да, то кто именно и как она будет 
83,использоваться; 
84,* будет ли ваша личная информация предоставляться кому-либо еще, если да, то кому; 
85,* какой выбор у вас есть относительно использования вашей личной информации; 
86,* каким образом вы можете получить доступ и, при необходимости, изменить личную 
87,информацию, которую компания собирает и хранит; 
88,* проводится ли сбор информации от детей до 13 лет, если да, то каким образом; 
89,* как компания обеспечивает безопасность, качество и целостность данных и 
90,* где и как можно задать вопросы или оформить жалобы.
91,Настоящая Политика конфиденциальности в настоящее время применяется на веб-сайтах и 
92,другой онлайн-собственности, управляемой Activision, на которых опубликована настоящая 
93,Политика конфиденциальности или ссылка на нее, включая, но не ограничиваясь, следующими:
94,www.activision.com
95,www.callofduty.com
96,www.callofduty/elite.com
97,www.guitarhero.com
98,Skylanders Cloud Patrol (доступно как приложение для выбранных операционных систем для  
99,мобильного телефона и планшета) 
100,Кроме того, Activision владеет также несколькими другими веб-сайтами и другой онлайн-
101,собственностью, не перечисленной выше, и мы можем время от времени добавлять новые веб-
102,сайты и другую онлайн-собственность, которые могут быть или не быть перечислены выше. 
103,Обратите внимание, однако, что настоящая Политика конфиденциальности относится только к 
104,веб-сайтам и другой онлайн-собственности Activision, где опубликована настоящая Политика 
105,конфиденциальности или ссылка на нее, но не к веб-сайтам или другой онлайн-собственности, 
106,поддерживаемой другими компаниями или организациями, на которую мы публикуем ссылки, и 
107,Activision не может и не гарантирует безопасность любой личной информации, разглашаемой на 
108,этих сайтах третьих сторон. Кроме того, пожалуйста, обратите внимание, что мы можем просить 
109,третьи стороны о сборе личной информации от нашего имени, и в таких случаях третьи стороны 
110,будут проинструктированы относительно соблюдения настоящей Политики конфиденциальности 
111,и действующего законодательства о защите данных. И наконец, пожалуйста, обратите внимание, 
112,что настоящая Политика конфиденциальности распространяется только на сбор, использование и 
113,разглашение информации, полученной онлайн, а не на сбор информации, полученной в 
114,автономном режиме. Любой сбор информации, полученной в автономном режиме, также будет 
115,проводиться в соответствии с действующим законодательством о защите данных.
116,Activision имеет действующую лицензию программы онлайн-конфиденциальности ESRB. Если вы 
117,считаете, что мы не ответили на ваш запрос, или ваш запрос не был удовлетворительно 
118,рассмотрен, пожалуйста, свяжитесь с ESRB:
119,
120,http://www.esrb.org/privacy/contact.jsp
121,ESRB 
122,Attn.:Privacy Online Program 
123,317 Madison Avenue , 22nd Floor 
124,New York , NY 10017 
125,privacy@esrb.org
126,
127,Какую информацию собирает Activision?
128,Activision получает личную информацию от вас только на добровольной основе. Когда вы 
129,предоставляете личную информацию Activision, это, как правило, происходит в форме: (1) 
130,регистрации на веб-сайте; (2) конкурсов и промоакций; (3) обслуживания клиентов; (4) 
131,демозагрузок; (5) приобретения продукта или услуги через наши интернет-магазины; (6) 
132,использования веб-сайта или другой онлайн-собственности (включая онлайн-сервисы (как 
133,определено ниже)); (7) онлайн-предоставления вашего резюме на вакансии. Информация, 
134,которую мы собираем, может включать личную информацию, такую как ваше имя, адрес 
135,электронной почты, номер телефона и домашний адрес. Кроме того, мы можем собирать 
136,демографическую информацию, такую как ваш возраст, пол и интересы. Мы можем также 
137,получать информацию о вас из других источников, если только эти другие источники имеют 
138,законное право делиться такой информацией, и добавлять эту информацию к информации, 
139,которую мы получили от вас.
140,* Регистрация на веб-сайте  
141,Activision может получать личную информацию от вас при регистрации в качестве члена веб-
142,сайта или другой онлайн-собственности, включая ваше имя, адрес, адрес электронной почты и 
143,номер телефона. Мы также можем собирать демографическую информацию, такую как ваш пол и 
144,дата рождения, которую мы можем добавить к вашей личной информации и использовать ее в 
145,маркетинговых целях. Как только эта информация объединяется, все вместе считается личной 
146,информацией. Информация, полученная от тех, кто регистрируется на наших веб-сайтах или 
147,другой онлайн-собственности, используется для предоставления зарегистрировавшимся 
148,преимуществ, связанных с такой регистрацией (например, подписка на рассылки, доступ к 
149,последним новостям игр и конкурсам, доски объявлений, чаты и форумы, а также регистрация 
150,продукта). Периодически мы можем связываться с вами с целью узнать ваше мнение по 
151,некоторым вопросам в виде онлайн-опросов и исследований, в том числе ваше мнение 
152,относительно наших игр или других продуктов и услуг. Ваши ответы на эти опросы помогают нам 
153,предоставлять продукты и услуги, интересные для вас.
154,* Конкурсы и промоакции 
155,Время от времени Activision может проводить конкурсы и промоакции на наших веб-сайтах и 
156,другой онлайн-собственности и собирать определенную личную информацию в связи с таким 
157,событием. Информация может включать ваше имя, адрес, адрес электронной почты, номер 
158,телефона и дату рождения. Эта информация будет использоваться только с целью вашего 
159,участия в конкурсах и промоакциях, связанных с конкретными продуктами, а также для того, 
160,чтобы информировать вас о новых продуктах и услугах.
161,* Обслуживание клиентов 
162,Для того чтобы предоставить вам наилучшее клиентское обслуживание, Activision может получать 
163,от вас некоторую личную информацию, включая ваше имя, адрес электронной почты и дату 
164,рождения. Эта информация будет использоваться только с целью обработки вашего запроса в 
165,службу поддержки клиентов и будет храниться в течение двенадцати (12) месяцев на случай 
166,возникновения дополнительных запросов в службу поддержки клиентов.
167,* Демозагрузки / Контент с рейтингом «Только для взрослых» 
168,От посетителей, заинтересованных в получении доступа к контенту с рейтингом «Только для 
169,взрослых» или загрузке демонстрационных версий игр Activision с рейтингом ESRB "M" (для 
170,взрослых) или PEGI 18, может потребоваться предоставление номера действительной кредитной 
171,карты и срока ее действия. Такая информация будет использоваться только с целью проверки 
172,возраста и не будет сохраняться. 
173,* Резюме 
174,Activision дает возможность онлайн-предоставления резюме. Личная информация, полученная в 
175,связи с предоставлением резюме, будет использована исключительно с целью принятия и оценки 
176,кандидатов на вакансии. Эта информация может быть распространена внутри группы Activision, 
177,если вы предварительно дали свое согласие или если соответствующая вакансия относится к 
178,другой компании, входящей в группу Activision. Информация, полученная в связи с 
179,предоставлением резюме, не подлежит условиям настоящего Положения об онлайн-
180,конфиденциальности.
181,*Онлайн-сервисы
182,Activision может предоставить вам различные онлайн-сервисы, такие как учетные записи и 
183,онлайн-игры («Онлайн-сервисы»). Activision может получать от вас информацию неличного 
184,характера, такую как баллы, рейтинги, статистика игры, использование функций игры и 
185,достижения. Мы также можем получать информацию, хранящуюся в ваших предпочтениях в 
186,учетной записи и на онлайн-страницах, в том числе, например, ваши покупки и списки друзей. 
187,Activision может объединить информацию неличного характера с личной информацией с целью 
188,адаптировать рекламу, веб-страницы, опыт игры, продукты, виртуальные товары и онлайн-
189,сервисы для вас.
190,Кроме того, использование определенных функций онлайн-сервисов, таких как доски 
191,объявлений, личные страницы и другой пользовательский контент, может быть связано с 
192,раскрытием вами личной информации о вас. Вы признаете, что не имеете права и не ожидаете 
193,конфиденциальности, используя такие функции онлайн-сервисов. 
194,В некоторых случаях мы можем использовать игровой сервис третьей стороны, чтобы обеспечить 
195,аутентификацию для онлайн-сервисов, и в таком случае вас могут попросить предоставить 
196,информацию из вашей учетной записи, связанную с данным сервисом третьей стороны при 
197,подписке на онлайн-сервисы. Кроме того, при регистрации на онлайн-сервисах непосредственно 
198,с игрового сервиса третьей стороны, определенная информация о членстве будет автоматически 
199,передана Activision, когда вы регистрируетесь.
200,* Приобретение товаров или услуг через наш интернет-магазин 
201,
202,Посетители, покупающие товары и услуги через один из наших дочерних интернет-магазинов, 
