1124,активы, коды, достижения и так далее. Вы признаете, что хотя иногда вы можете "зарабатывать", 
1125,покупать или "приобретать" предоставляемый службами контент, у вас нет права собственности 
1126,в отношении такого предоставляемого службами контента, и цена какого-либо предоставляемого 
1127,службами контента не относится к кредитному балансу в реальной валюте или ее эквивалентам.  
1128,Если иное не указано в предоставляемом службами контенте или сопроводительном документе 
1129,(например, в лицензионном соглашении конечного пользователя и (или) лицензионном договоре), 
1130,любой предоставляемый службами контент, который вы получаете, передается вам по лицензии в 
1131,соответствии с разделом 3 и регулируется всеми остальными положениями настоящего Договора и 
1132,Политикой конфиденциальности Activision. 
1133,9.2 Activision не разрешает передачу Учетных записей или предоставляемого службами контента.  Вы 
1134,не вправе приобретать, продавать, перепродавать, сдавать в аренду, брать в аренду, дарить, 
1135,менять или иным образом передавать какую-либо учетную запись или материалы Продукции. 
1136,Любая попытка такого действия не имеет юридической силы.
1137,9.3 Вы не вправе продавать Продукцию или предоставляемый службами контент, включая, среди 
1138,прочего, игровые предметы или валюту, в обмен на "настоящие" деньги, а также обменивать 
1139,такие предметы или валюты на ценности вне Продукции.
1140,9.4 При аннулировании любой Учетной записи, Договора или лицензии вы обязуетесь во всех 
1141,предусмотренных законом случаях отказаться от доступа или контроля над любым аспектом 
1142,вышеуказанного.
1143,
1144,10. СОГЛАСИЕ НА НАБЛЮДЕНИЕ
1145,10.1 Общение, ведущееся при использовании Продукции, не должно считаться личным. Activision 
1146,вправе наблюдать и (или) вести запись вашего общения (включая, среди прочего, сообщения в 
1147,чате) при использовании Продукции. Настоящим вы предоставляете неотзывное прямое согласие 
1148,на такое наблюдение и запись. Вы признаете, что вы не ожидаете сохранения конфиденциальности 
1149,в отношении передачи ПК или сообщений, включая, среди прочего, текстовые сообщения в чате и 
1150,голосовые сообщения. Так как голосовой чат и другие сообщения доступны для просмотра и (или) 
1151,прослушивания другим пользователям, пользователи должны избегать раскрытия 
1152,персонифицированной информации.
1153,
1154,
1155,10.2 Кроме того, Activision вправе, уведомляя или не уведомляя вас о своих намерениях, раскрыть ваш 
1156,IP-адрес, личную информацию, журналы чата и другую информацию о вас и ваших действиях: (a) в 
1157,ответ на запрос правоохранительных служб, судебное распоряжение или иной судебный приказ; 
1158,или (b) если Activision считает, что таким образом можно защитить собственные права и 
1159,собственность Activision, вашу безопасность или безопасность других
1160,
1161,11. ПОДДЕРЖКА 
1162,
1163,Если хотите подать жалобу в отношении Продукции или хотите получить дополнительные сведения об 
1164,использовании Продукции, посетите страницу службы поддержки Activision www.support.activision.com.
1165,
1166,12. СРОК ДЕЙСТВИЯ  
1167,Лицензия, передаваемая настоящим Договором, действует до момента расторжения Договора вами или 
1168,Activision. Ваши права по настоящему Договору прекращают свое действие автоматически без уведомления 
1169,от Activision, если вы нарушите одно из положений настоящего Договора или применимого Стороннего 
1170,соглашения. При расторжении лицензии вы обязуетесь прекратить использование Продукции и уничтожить 
1171,все копии (как частичные, так и полные) Продукции. 
1172,Activision оставляет за собой право расторгнуть настоящий Договор без причины незамедлительно после 
1173,передачи письменного уведомления. Максимальная ответственность Activision перед вам в случае такого 
1174,расторжения ограничена суммой, выплаченной вами и полученной Activision за Продукции в 
1175,предшествующие 12 (двенадцать) месяцев.
1176,13. ТРЕТЬИ ЛИЦА  
1177,Продукция может предоставлять или требовать доступ к материалам, службам или веб-сайтам третьих лиц 
1178,(далее "Материалы третьих лиц"). Использование Материалов третьих лиц может регулироваться 
1179,дополнительными правилами обслуживания. 
1180,Вы понимаете, что используя любые Материалы третьих лиц, вы можете встретить контент, который может 
1181,считаться оскорбительным, непристойным или неприемлемым. Вы соглашаетесь (i) использовать 
1182,Материалы третьих лица на свой собственный риск; (ii) что Activision не несет перед вами ответственность за 
1183,Материалы третьих лиц; (iii) что Activision не несет ответственность за изучение или оценку контента, 
1184,точность, полноту, своевременность, достоверность, законность авторских прав, законность, пристойность, 
1185,качество или иной другой аспект таких Материалов третьих лиц. Материалы третьих лиц предоставляются 
1186,исключительно для вашего удобства. 
1187,Ваше право использовать Продукцию также основано на вашем согласии с любыми применимыми 
1188,условиями обслуживания, правилами использования и политиками конфиденциальности, которые вы 
1189,приняли от третьих лиц (например, соглашения с корпорацией Apple в отношении приобретения и 
1190,использования Приложений, продаваемых через iTunes Store, либо с вашим поставщиком интернет-услуг в 
1191,отношении доступа к Интернету) (далее "Сторонние соглашения").
1192,Соответствующие третьи лица (например, поставщик вашей учетной записи для консоли, мобильной связи 
1193,или доступа к Интернету) вправе также накладывать ограничения на использование или доступ к 
1194,определенной Продукции при любых условиях без каких-либо уведомлений или ответственности. Вы 
1195,признаете, что Activision не несет ответственность за какие-либо действия или бездействие таких третьих 
1196,лиц.
1197,14. ОТКАЗ ОТ ГАРАНТИИ И ОГРАНИЧЕНИЕ ОТВЕТСТВЕННОСТИ
1198,
1199,14.1 ОТКАЗ ОТ ГАРАНТИИ.
1200,ВО ВСЕХ ПРЕДУСМОТРЕННЫХ ЗАКОНОМ СЛУЧАЯХ ПРОДУКЦИЯ ПРЕДОСТАВЛЯЕТСЯ "КАК ЕСТЬ" И ACTIVISION 
1201,НЕ ГАРАНТИРУЕТ, ЧТО ПРОДУКЦИЯ БУДЕТ ФУНКЦИОНИРОВАТЬ БЕЗ ОШИБОК ИЛИ СБОЕВ; ЧТО ОШИБКИ 
1202,БУДУТ ИСПРАВЛЕНЫ; ЧТО ПРОДУКЦИЯ НЕ СОДЕРЖИТ ВИРУСЫ ИЛИ ДРУГИЕ КОМПОНЕНТЫ ЗЛОВРЕДНОГО 
1203,ПРОГРАММНОГО ОБЕСПЕЧЕНИЯ; ЧТО ВСЕ СОДЕРЖИМОЕ ПРОДУКЦИИ ЯВЛЯЕТСЯ ТОЧНЫМ.  В 
1204,ПРЕДУСМОТРЕННЫХ ЗАКОНОМ СЛУЧАЯХ ACTIVISION ОТКАЗЫВАЕТСЯ ОТ КАКИХ-ЛИБО ГАРАНТИЙ, ЯВНЫХ И 
1205,ПОДРАЗУМЕВАЕМЫХ, ВКЛЮЧАЯ, СРЕДИ ПРОЧЕГО, ГАРАНТИЮ ПРИГОДНОСТИ К ПРОДАЖЕ, ИСПОЛЬЗОВАНИЯ 
1206,В ОПРЕДЕЛЕННЫХ ЦЕЛЯХ И СОБЛЮДЕНИЯ ПРАВ ТРЕТЬИХ СТОРОН.
1207,
1208,Австралия: в соответствии с Законом Австралии о защите прав потребителей у вас есть определенные 
1209,предусмотренные законом гарантии, и ни одно из положений настоящего Договора не ущемляет эти права.
1210,
1211,
1212,14.2 ОГРАНИЧЕНИЕ ОТВЕТСТВЕННОСТИ.
1213,A. ВО ВСЕХ ПРЕДУСМОТРЕННЫХ ЗАКОНОМ СЛУЧАЯХ КОМПАНИЯ ACTIVISION И ЕЕ РОДИТЕЛЬСКИЕ 
1214,КОМПАНИИ, ДОЧЕРНИЕ КОМПАНИИ, ЛИЦЕНЗИАРЫ ИЛИ АФФИЛИРОВАННЫЕ ЛИЦА НИ ПРИ КАКИХ 
1215,ОБСТОЯТЕЛЬСТВАХ НЕ НЕСУТ ОТВЕТСТВЕННОСТЬ ЗА КАКОЙ-ЛИБО УРОН ИЛИ УЩЕРБ, ВОЗНИКШИЙ В 
1216,РЕЗУЛЬТАТЕ A) ИСПОЛЬЗОВАНИЯ ИЛИ НЕВОЗМОЖНОСТИ ИСПОЛЬЗОВАТЬ ПРОДУКЦИЮ, ВКЛЮЧАЯ, 
1217,СРЕДИ ПРОЧЕГО, УЩЕРБ РЕПУТАЦИИ, ПЕРЕРЫВ В РАБОТЕ, ОТКАЗ ИЛИ НЕИСПРАВНОСТЬ 
1218,КОМПЬЮТЕРНОГО ОБОРУДОВАНИЯ; B) УРОНА ИЛИ УЩЕРБА ПЕРСОНАЖЕЙ, УЧЕТНЫХ ЗАПИСЕЙ, 
1219,СТАТИСТИКИ, СНАРЯЖЕНИЯ ИЛИ ДАННЫХ ПРОФИЛЯ ПОЛЬЗОВАТЕЛЯ; ИЛИ C) НАРУШЕНИЙ В РАБОТЕ 
1220,СЛУЖБ, ВКЛЮЧАЯ, СРЕДИ ПРОЧЕГО, СБОИ В РАБОТЕ ИНТЕРНЕТ-ПРОВАЙДЕРОВ, СБОИ В РАБОТЕ 
1221,ПРОГРАММ ИЛИ ОБОРУДОВАНИЯ, А ТАКЖЕ ЛЮБЫЕ ДРУГИЕ СОБЫТИЯ, КОТОРЫЕ МОГУТ ПРИВЕСТИ К 
1222,ПОТЕРЕ ДАННЫХ ИЛИ НАРУШЕНИЮ РАБОТЫ СЛУЖБ.  НИ ПРИ КАКИХ ОБСТОЯТЕЛЬСТВАХ ACTIVISION 
1223,НЕ НЕСЕТ ОТВЕТСТВЕННОСТЬ ПЕРЕД ВАМИ ИЛИ КЕМ-ТО ЕЩЕ ЗА ЛЮБОЙ СЛУЧАЙНЫЙ, КОСВЕННЫЙ, 
1224,ОСОБЫЙ, ШТРАФНОЙ, КАРАТЕЛЬНЫЙ ИЛИ ИНОЙ УЩЕРБ.
1225,
1226,B. НИ ПРИ КАКИХ ОБСТОЯТЕЛЬСТВАХ ОТВЕТСТВЕННОСТЬ ACTIVISION НЕ ПРЕВЫШАЕТ СУММУ, 
1227,ВЫПЛАЧЕННУЮ ВАМИ НАМ В ТЕЧЕНИЕ 12 (ДВЕНАДЦАТИ) МЕСЯЦЕВ ДО ВОЗНИКНОВЕНИЯ 
1228,ОСНОВАНИЯ ДЛЯ ДЕЙСТВИЯ. 
1229,
1230,C. ВАЖНАЯ ИНФОРМАЦИЯ ОБ ОТКАЗЕ ОТ ГАРАНТИИ И ОГРАНИЧЕНИИ ОТВЕТСТВЕННОСТИ. 
1231,ЗАКОНОДАТЕЛЬСТВО РЯДА РЕГИОНОВ НЕ ДОПУСКАЕТ ОТКАЗА ОТ ОПРЕДЕЛЕННЫХ ГАРАНТИЙ ЛИБО 
1232,ИСКЛЮЧЕНИЯ ИЛИ ОГРАНИЧЕНИЯ ОТВЕТСТВЕННОСТИ ЗА КОСВЕННЫЙ, СЛУЧАЙНЫЙ ИЛИ ИНОЙ ВИД 
1233,УЩЕРБА. В ТАКИХ РЕГИОНАХ У ВАС МОГУТ БЫТЬ ДРУГИЕ ИЛИ ДОПОЛНИТЕЛЬНЫЕ ПРАВА В 
1234,СООТВЕТСТВИИ С ЗАКОНОДАТЕЛЬСТВОМ СТРАНЫ, В КОТОРОЙ ВЫ ЗАКОННО ПРИОБРЕЛИ И 
1235,ИСПОЛЬЗУЕТЕ ПРОДУКЦИЮ.  В ЭТОМ СЛУЧАЕ ОТВЕТСТВЕННОСТЬ  ACTIVISION И ЕЕ 
1236,АФФИЛИРОВАННЫХ ЛИЦ ОГРАНИЧЕНА РАМКАМИ ДЕЙСТВУЮЩЕГО ЗАКОНОДАТЕЛЬСТВА. ДЛЯ ЛИЦ, 
1237,КОТОРЫЕ ЗАКОННО ПРИОБРЕЛИ И ИСПОЛЬЗУЮТ ПРОДУКЦИЮ ИЗ СТРАНЫ ЕВРОПЕЙСКОГО СОЮЗА, 
1238,НИЧТО НЕ ИСКЛЮЧАЕТ ОТВЕТСТВЕННОСТЬ ACTIVISION ЗА ЛЕТАЛЬНЫЙ ИСХОД ИЛИ ВРЕД ЗДОРОВЬЮ 
1239,ИЗ-ЗА ХАЛАТНОСТИ ACTIVISION.
1240,Бельгия, Дания, Финляндия, Германия, Норвегия, Швеция: в соответствии с разделом 23 Activision 
1241,несет ответственность по закону в случае (a) умысла; (b) преступной небрежности; (c) нарушения 
1242,закона Бельгии, Германии или Норвегии об ответственности за качество выпускаемой продукции 
1243,(применимо только для Бельгии, Германии и Норвегии соответственно). Без ограничения 
1244,вышесказанного, Activision может нести ответственность за средние уровни халатности в случае 
1245,нарушения "существенного" договорного обязательства по настоящему Договору, если подобное 
1246,нарушение ставит под угрозу цель Договора. В таких обстоятельствах ответственность Activision 
1247,ограничена типичным и предвидимым ущербом. В других обстоятельствах Activision не несет 
1248,ответственность за халатность среднего уровня.
1249,Европейский союз: ни одно из положений настоящего Договора не исключает ответственность 
1250,Activision за летальный исход или вред здоровью из-за халатности. 
1251,
1252,
1253,15. ВОЗМЕЩЕНИЕ УБЫТКОВ
1254,
1255,Вы обязуетесь ограждать и защищать Activision, ее аффилированных лиц, их управляющих, директоров, 
1256,владельцев, агентов, сотрудников, подрядчиков, поставщиков информации и лицензиаров (далее 
1257,Ограждаемая сторона или собирательно "Ограждаемые стороны") от любых требований, исков, 
1258,ущерба, обязательств, расходов и издержек (включая гонорары поверенных), которые понесет 
1259,Ограждаемая сторона в связи с (i) нарушением вами Договора и (или) (ii) публикацией или выгрузкой 
1260,вами Пользовательского контента.
1261,
1262,Activision оставляет за собой право использовать по собственному усмотрению любые средства защиты в 
1263,суде по любому вопросу, связанному с компенсацией, выплачиваемой вами. В таких случаях вы 
1264,обязуетесь сотрудничать с Activision в поддержку требований компании.
1265,
1266,16. РИСК ПОТЕРИ 
1267,
1268,Вы несете весь риск потери, связанный с доступом или завершением загрузки любой Продукции, а также с 
1269,потерей любой Продукцией, к которой вы получили доступ или которую загрузили, включая любой ущерб 
1270,из-за повреждения файлов или сбоя Устройства. 
1271,
1272,Любая продукция может быть доступна в течение ограниченного периода и (или) иметь другие ограничения 
1273,на доступ (включая, например, наличие другой определенной Продукции для доступа или использования).  
1274,Продукция может стать недоступной из-за лицензионных ограничений потенциального поставщика 
1275,контента или по другим причинам; во всех установленных законом случаях Activision не несет 
1276,ответственность перед вами, если какая-либо Продукция по какой-либо причине станет недоступной для 
1277,загрузки или доступа.
1278,
1279,17. ДОСТУПНОСТЬ
1280,
1281,Если иное не указано в настоящем Договоре, Activision не гарантирует, что какая-либо определенная 
1282,Продукция или предоставляемый службами контент будут доступны постоянно в любое время и что 
1283,Activision продолжит предоставлять Продукцию или предоставляемый службами контент в течение 
1284,определенного периода.  Activision вправе изменить и обновлять Продукцию или предоставляемый 
1285,службами контент без предварительного уведомления. Activision не гарантирует доступность сетевых 
1286,функций Продукции и оставляет за собой право вносить изменения или прекратить предоставление сетевых 
1287,функций Продукции по своему усмотрению без предварительного уведомления пользователей, включая, 
1288,например, закрытие сетевой службы по экономическим причинам из-за ограниченного количества 
1289,пользователей.
1290,Кроме того, Продукция, к которой осуществляется доступ с Устройства, отображается на Устройстве или 
1291,доступна по ссылке с Устройства, может быть недоступна на некоторых языках или в некоторых странах. Во 
1292,всех установленных законом случаях (i) Activision и ее лицензиары оставляют за собой право изменять, 
1293,приостанавливать, удалять или отключать доступ к любой Продукции в любое время без предварительного 
1294,уведомления пользователей; и (ii) Activision не несет ответственность за удаление или лишение доступа к 
1295,любой Продукции. 
1296,18. ПРАВО СОБСТВЕННОСТИ
1297,
1298,Все имущественные права, а также права на интеллектуальную собственность в отношении Продукции 
1299,(включая, среди прочего, все названия, товарные знаки, знаки обслуживания, торговые названия, 
1300,компьютерный код, темы, объекты, персонажей, имена персонажей, сюжет, диалоги, характерные 
1301,фразы, локации, концепции, художественные работы, анимацию, видео, звуки, аудиовизуальные 
1302,эффекты, музыкальные композиции, режимы работы, моральные права и любую сопутствующую 
1303,документацию), принадлежат компании Activision и (или) ее лицензиарам.  Продукция передается вам 
1304,для использования по лицензии, а не продается. Ваша лицензия не включает себя передачу вам в 
1305,собственность самой Продукции и не должна интерпретироваться как продажа каких бы то ни было прав 
1306,на Продукцию.  
1307,
1308,ВЫ ПРИЗНАЕТЕ, ЧТО ЗА ИСКЛЮЧЕНИЕМ ЛИЦЕНЗИИ, ПЕРЕДАВАЕМОЙ ВАМ НАСТОЯЩИМ ДОГОВОРОМ, ВЫ 
1309,НЕ ПОЛУЧАЕТЕ НИКАКИХ ПРАВ СОБСТВЕННОСТИ ИЛИ ИНОГО ИМУЩЕСТВЕННОГО ПРАВА НА ПРОДУКЦИЮ 
1310,ИЛИ ПРЕДОСАТВЛЯЕМЫЙ СЛУЖБАМИ КОНТЕНТ (ВКЛЮЧАЯ, СРЕДИ ПРОЧЕГО, ЛЮБЫЕ ВИРТУАЛЬНЫЕ 
1311,ТОВАРЫ). ВЫ ТАКЖЕ ПРИЗНАЕТЕ, ЧТО ВО ВСЕХ УСТАНОВЛЕННЫХ ЗАКОНОМ СЛУЧАЯХ ВСЕ ПРАВА НА 
1312,ТАКУЮ ПРОДУКЦИЮ И ПРЕДОСТАВЛЯЕМЫЙ СЛУЖБАМИ КОНТЕНТ ПРИНАДЛЕЖАТ И ВСЕГДА БУДУТ 
1313,ПРИНАДЛЕЖАТЬ ACTIVISION И ЕЕ ЛИЦЕНЗИАРАМ.
1314,Вы признаете, что вся Продукция и Материалы третьих лиц содержат проприетарный контент, информацию 
1315,и материалы, которые защищаются действующим законом о защите прав на интеллектуальную 
1316,собственность и иными законодательными актами, включая, среди прочего, закон о защите авторских прав. 
1317,Вы также обязуетесь не использовать такой проприетарный контент, информацию или материалы с какой-
1318,либо целью за исключением явно разрешенных случаев. Воспроизведение какой-либо части Продукции или 
1319,Материалов третьих лиц в любом виде любым способом запрещено за исключением случаев, разрешенных 
1320,по соответствующей лицензии. 
1321,19. ОПЛАТА
1322,
