897,которая будет доступна общественности, включая людей, не являющихся зарегистрированными 
898,пользователями Продукции. Люди могут получить доступ и использовать такую информацию, а 
899,также связать ее с вами.  Вы признаете и подтверждаете, что вы не рассчитываете на 
900,сохранение конфиденциальности при использовании таких функций Продукции, включая, среди 
901,прочего, выгрузку и публикацию ПК; сравнивание статистики, личных рекордов и достижений с 
902,другими игроками; поиск других игроков по имени пользователя; поиск событий, в которых 
903,участвуют другие пользователи; связь с учетными записями социальных сетей, в которых 
904,информация о пользователе опубликована открыто.  Например, заходя из Продукции в свою 
905,учетную запись социальной сети (если такая функция доступна), вы признаете, что в 
906,соответствии с настройками конфиденциальности для вашей учетной записи в социальной сети, 
907,а также в соответствии с политикой конфиденциальности Activision, Activision вправе связать и 
908,отображать ваши игровые данные, включая ваш тег игрока и (или) имя пользователя, с данными 
909,вашей учетной записи в социальной сети, включая, например, ваше имя и имена ваших друзей, 
910,которые также используют Продукцию.  Для получения дополнительных сведений см. раздел 8.5.
911,
912,7. УВЕДОМЛЕНИЕ ОБ АВТОРСКИХ ПРАВАХ
913,
914,
915,7.1 Activision уважает права на интеллектуальную собственность третьих лиц и считает, что игроки и 
916,пользователи ее услуг должны поступать так же. Если вы считаете, что какой-либо контент в 
917,Продукции и (или) ПК скопирован таким образом, что нарушает чьи-либо авторские права, сообщите 
918,следующую информацию указанному ниже агенту по авторским правам.
919,7.2 Пожалуйста, учтите, что ваше заявление о нарушении авторских прав должно соответствовать 
920,требованиям Закона о защите авторских прав в цифровую эпоху (далее "DMCA"). Смотрите 17 свод 
921,законов США 17, § 512(c)(3) DMCA или проконсультируйтесь с юристом перед подачей такого 
922,заявления.
923,7.3 Чтобы подать заявление о нарушении авторских прав, вам необходимо отправить письменное 
924,сообщение по указанному ниже адресу с указанием следующей информации:
925,
926,
927,
928,A. Ваше имя, почтовый адрес, номер телефона и адрес электронной почты;
929,
930,B. Описание авторской работы, права на которую, как вам кажется, были нарушены;
931,
932,C. Точный URL-адрес или описание местонахождения материалов, права на которые, как вам 
933,кажется, были нарушены;
934,
935,D. Ваше подтверждение, что вы искренне верите, что соответствующее использование не было 
936,санкционировано владельцем прав, его агентом или законодательством;
937,
938,E. Электронная или физическая подпись лица, которое вправе действовать от лица владельца 
939,авторских прав; и
940,
941,F. Ваше подтверждение, что вы несете ответственность за предоставление заведомо неверных 
942,сведений, и указанная выше информация является точной, а также что вы являетесь 
943,владельцем авторских прав или действуете от лица владельца авторских прав.
944,
945,Activision Publishing, Inc. 
946,3100 Ocean Park Boulevard 
947,Santa Monica, California 90405 
948,На имя: Activision Business and Legal Affairs  
949,Факс: (310) 255-2152  
950,E-Mail: legalaffairs@activision.com 
951,
952,
953,7.4 Пожалуйста, учтите, что в соответствии с DMCA вы можете нести ответственность за ущерб (включая 
954,издержки и гонорары поверенных), если вы заведомо предоставляете неверные сведения о 
955,нарушении прав. Также учтите, что данные, предоставляемые в вашем заявлении о нарушении 
956,авторских прав, могут быть переданы лицу, ответственному за публикацию материала, права на 
957,который, по вашему мнению, были нарушены.
958,
959,8. УЧЕТНЫЕ ЗАПИСИ ACTIVISION (включая учетные записи для Call of Duty Elite)
960,
961,
962,
963,ВЫ НЕСЕТЕ ОТВЕТСТВЕННОСТЬ ЗА ВСЕ ДЕЙСТВИЯ, ВЫПОЛНЯЕМЫЕ В ВАШЕЙ УЧЕТНОЙ ЗАПИСИ. 
964,НИКОМУ НЕ СООБЩАЙТЕ ПАРОЛЬ ОТ СВОЕЙ УЧЕТНОЙ ЗАПИСИ. 
965,
966,8.1 РЕГИСТРАЦИЯ
967,Если Продукция требует от вас предоставления регистрационных данных, все такие требования 
968,регулируются настоящим Договором и Политикой конфиденциальности Activision, которая включена 
969,сюда посредством ссылки вместе со всеми Сторонними соглашениями. Вы можете предоставлять или 
970,не предоставлять такую информацию на свое усмотрение. Однако, если вы решите не предоставлять 
971,данные, ваш доступ к Продукции может быть ограничен или закрыт. Если вы решите предоставить 
972,необходимые данные, вы гарантируете, что предоставляете только достоверную, актуальную и 
973,точную информацию. Вы обязуетесь не выдавать себя за третье физическое или юридическое лицо и 
974,не предоставлять ложных сведений о своей личности или связях с другими лицами. Вас будут 
975,регулярно просить подтвердить свои регистрационные данные (например, адрес электронной 
976,почты), чтобы продолжить использовать Продукцию. Если вы согласитесь, ваш доступ к Продукции 
977,может быть ограничен или закрыт.
978,
979,8.2 ТРЕБОВАНИЯ К ПОЛЬЗОВАТЕЛЯМ
980,Вы подтверждаете, что вы старше возраста, указанного в соответствующем возрастном рейтинге или 
981,ограничении для Продукции, а также что вы дееспособны и вправе выполнять условия, положения, 
982,обязательства и нести ответственность по настоящему Договору, а также полностью выполнять 
983,условия Договора.
984,
985,В соответствии с применимым возрастным рейтингом или иными ограничениями вы вправе создать 
986,Учетную запись, только если (i) вы старше 18 лет и являетесь "физическим лицом" в стране 
987,проживания; или (ii) ваш родитель или опекун прочтет и согласится с условиями настоящего Договора 
988,и Политики конфиденциальности Activision от своего и вашего лица (если вы старше 13, но моложе 18 
989,лет). Корпорации, общества с ограниченной ответственностью, партнерства и иные юридические 
990,лица не вправе создавать Учетные записи. Лица, которым Activision запретила использовать 
991,Продукцию, не вправе создавать или использовать Учетную запись. В противном случае, такие 
992,действия будут преследоваться по закону. Соглашаясь с условиями настоящего Договора, вы 
993,гарантируете, что удовлетворяете этим требованиям.
994,
995,8.3 РОДИТЕЛИ И ОПЕКУНЫ
996,Вы обязуетесь нести ответственность за все использование Учетной записи вашим ребенком, 
997,независимо от того, было ли такое использование вами одобрено. Ни одно из положений настоящего 
998,Договора не ограничивает права Activision на приостановление, закрытие или удаление любой 
999,действующей Учетной записи. 
1000,
1001,Учетные записи Skylanders Universe не собирают персонифицированные данные (такие, как имя или 
1002,адрес). На такие учетные записи не распространяются возрастные ограничения, но требуется 
1003,согласие или одобрение родители или опекуна, который должен отправить по электронной 
1004,почте подтверждение о согласии с условиями настоящего Договора и Политики 
1005,конфиденциальности Activision от лица ребенка для регистрации учетной записи Skylanders 
1006,Universe.
1007,
1008,
1009,8.4 ПРИОСТАНОВЛЕНИЕ ИЛИ ЗАКРЫТИЕ УЧЕТНОЙ ЗАПИСИ
1010,ACTIVISION ВПРАВЕ ПРИОСТАНОВИТЬ, ЗАКРЫТЬ ИЗМЕНИТЬ ИЛИ УДАЛИТЬ ЛЮБУЮ УЧЕТНУЮ ЗАПИСЬ 
1011,В ЛЮБОЕ ВРЕМЯ ПО ЛЮБОЙ ПРИЧИНЕ ИЛИ БЕЗ ПРИЧИНЫ, ОТПРАВИВ ИЛИ НЕ ОТПРАВЛЯЯ ВАМ 
1012,ПРЕДВАРИТЕЛЬНОЕ УВЕДОМЛЕНИЕ, ВО ВСЕХ ПРЕДУСМОТРЕННЫХ ЗАКОНОМ СЛУЧАЯХ.  В целях 
1013,объяснения, а не ограничения, большинство случаев приостановления, закрытия и (или) удаления 
1014,учетных записей являются результатом нарушения настоящего Договора.
1015,
1016,8.5 СОЦИАЛЬНЫЕ СЕТИ
1017,Если являетесь зарегистрированным пользователем социальных сетей, можно связать вашу учетную 
1018,запись социальной сети с учетной записью Activision (если для учетной записи Activision разрешена 
1019,эта функция). Если вы это сделаете, вы сможете использовать свои данные из социальной сети для 
1020,поиска своих "друзей" из социальной сети. А ваши "друзья" могут использовать свои данные из 
1021,социальной сети для поиска вас и вашей учетной записи Activision.
1022,
1023,Если вы свяжете свою учетную запись Facebook с учетной записью Activision, например Call of Duty 
1024,Elite или Activate, ваши друзья из Facebook смогут связать ваше имя пользователя Activision с вашим 
1025,настоящим именем в Facebook, если они воспользуются функцией поиска друзей Facebook. Ваши 
1026,учетные записи в социальных сетях регулируются отдельными Сторонними соглашениями (в 
1027,отношении Facebook смотрите также "Положение о правах и обязанностях" на сайте Facebook). Вы 
1028,признаете и подтверждаете, что поставщик вашей учетной записи в социальной сети (включая, среди 
1029,прочего Facebook) не несет ответственности за вашу учетную запись Activision, включая любую 
1030,ответственность, связанную с использованием вашей учетной записи Activision. Вы также признаете и 
1031,подтверждаете, что независимо от того, используете ли вы анонимный тег игрока или имя 
1032,пользователя, после связи учетной записи Activision с учетной записью в социальной сети ваше 
1033,настоящее имя будет доступно для просмотра вашим "друзьям" из социальной сети. 
1034,Дополнительные сведения о социальных сетях смотрите в Политике конфиденциальности Activision.
1035,
1036,
1037,8.6 ИМЯ ПОЛЬЗОВАТЕЛЯ И ГРУППЫ
1038,В зависимости от используемой Продукции и платформы (например, консоль или операционная 
1039,система мобильного телефона) ваше имя пользователя в платформе может использоваться в 
1040,качестве вашего  имени пользователя в учетной записи Activision.   КРОМЕ ТОГО, НЕКОТОРЫЕ 
1041,УЧЕТНЫЕ ЗАПИСИ ACTIVISION МОГУТ ПОЗВОЛЯТЬ ПОЛЬЗОВАТЕЛЯМ СОЗДАВАТЬ РАЗЛИЧНЫЕ 
1042,КЛАНЫ, "ОТРЯДЫ", "КОМАНДЫ" И ДРУГИЕ ГРУППЫ (ДАЛЕЕ СОБИРАТЕЛЬНО "ГРУППЫ") С 
1043,УНИКАЛЬНЫМ ИМЕНЕМ ГРУППЫ. При выборе имени пользователя, имени группы или иного ярлыка, 
1044,доступного для просмотра другим пользователям, вы обязаны соблюдать следующие правила, а 
1045,также правила приличия  Если Activision признает такое имя оскорбительным или ненадлежащим, 
1046,Activision вправе на свое усмотрение изменить или удалить имя и (или) приостановить или 
1047,закрыть для вас доступ к услугам.  В частности, вы не вправе использовать имя:
1048,
1049,A. Которое принадлежит другому лицу, с намерением выдать себя за такое лицо, включая, 
1050,среди прочего, администраторов Продукции, а также сотрудников или агентов Activision;
1051,
1052,B. Которое включает непристойные выражения или является оскорбительным, порочащим, 
1053,непристойным, разжигающим расовую, половую, этническую или иную ненависть;
1054,
1055,C. Права на которое принадлежат другому физическому или юридическому лицу, без 
1056,письменного разрешения такого лица;
1057,
1058,D. Которое принадлежит или относится к известной личности, представителю культуры, 
1059,кумиру или персонажу;
1060,
1061,E. Которое содержит или является по существу аналогичным товарному знаку или знаку 
1062,обслуживания, как зарегистрированному, так и незарегистрированному.
1063,
1064,F. Которое принадлежит религиозному деятелю или божеству; или
1065,
1066,G. Связано с наркотиками, сексом, алкоголем или преступной деятельностью.
1067,
1068,Запрещено использовать орфографические ошибки или разные варианты написания для обхода 
1069,вышеперечисленных ограничений. Также запрещено указывать имя и фамилию, которые вместе 
1070,нарушают вышеперечисленные ограничения.
1071,
1072,Во всех установленных законом случаях вы несете ответственность за использование своей Учетной 
1073,записи.  О любом несанкционированном использовании вашего имени пользователя, пароля, данных 
1074,учетной записи, а также о любых нарушениях безопасности, о которых вам стало известно в 
1075,отношении вашей Учетной записи, вы обязаны немедленно сообщить Activision.  Такое уведомление 
1076,необходимо подать на странице службы поддержки www.support.activision.com.
1077,
1078,
1079,8.7 УСЛОВИЯ CALL OF DUTY ELITE 
1080,
1081,A. Без ограничения смысла других положений настоящего Договора, использование Продукта Call 
1082,of Duty Elite также регулируется Лицензионным соглашением Call of Duty (далее "ЛС"), 
1083,сопровождающее игры, для которых доступна Продукция.  ЛС регулирует использование игры, 
1084,а настоящий Договор регулирует использование Call of Duty Elite независимо от платформы, на 
1085,которой вы используете Call of Duty Elite (например, игровая консоль, сеть, мобильный телефон 
1086,и так далее). Использование Call of Duty Elite также регулируется и требует наличия сетевой 
1087,учетной записи консоли с сетевой функциональностью Call of Duty, а также согласия у 
1088,условиями использования такой учетной записи.
1089,
1090,B. Call of Duty Elite может регулярно предлагать вам возможность участия в конкурсах и 
1091,лотереях. Такие конкурсы и лотереи регулируются определенными правилами и нормами 
1092,поведения (которые включены по ссылке в настоящий Договор), которые будут 
1093,опубликованы на странице соответствующего конкурса, лотереи или в другом разделе Call of 
1094,Duty Elite.  Ваше участие в конкурсе или лотерее обусловлено вашим согласием с такими 
1095,условиями. Для определенных конкурсов и лотерей Activision оставляет за собой право 
1096,ограничить количество призов, которое может выиграть участник за определенный период 
1097,времени. Перед участием в конкурсе или лотерее вы обязаны внимательно просмотреть 
1098,соответствующие правила и информацию о подаче заявки на такой конкурс или лотерею, 
1099,чтобы подтвердить, что вы имеете право выиграть соответствующие призы.  Победители, 
1100,которые не отвечают требованиям к участию или не могут забрать или использовать свой 
1101,приз, не имеют права на замену или компенсацию призов.  Требования к участию в конкурсах 
1102,и лотереях могут включать возрастные ограничения, указанные в рейтинге соответствующей 
1103,поддерживаемой игры Call of Duty (например, возрастной рейтинг Call of Duty: Black Ops II в 
1104,США - ESRB 17, в Евросоюзе (за исключением Германии) - PEGI 18, в Германии - USK 18, в 
1105,Австралии - ACB 15). Для участников из одобренных стран без соответствующей системы 
1106,возрастного рейтинга Activision вправе установить минимальный возраст 18 лет в соответствии 
1107,с рейтингом PEGI и USK. Минимальные возрастные требования будут указаны перед 
1108,зачислением в соответствующий конкурс или лотерею и будут являться требованием для 
1109,участия в таком конкурсе или лотерее. Доступность, частота проведения и требования к 
1110,участникам конкурсов и лотерей устанавливаются Activision на свое усмотрения и 
1111,регулируются местным законодательством и ограничениями.  
1112,
1113,C. Вступая в клан Call of Duty Elite, вы признаете, что лидер вашего клана уполномочен подавать 
1114,заявки от лица клана на участие в одном или нескольких конкурсах. Такая заявка подается от 
1115,лица клана и всех его членов. 
1116,
1117,D. Не забывайте делать частые перерывы при участие в конкурсах, использовании игр Activision 
1118,или Call of Duty Elite.  
1119,
1120,9. ПРЕДОСТАВЛЯЕМЫЙ СЛУЖБАМИ КОНТЕНТ
1121,
1122,9.1 "Предоставляемый службами контент" состоит из материалов, предоставляемых пользователям 
1123,Продукции (с Учетной записи или без нее), таких как разблокируемый контент, виртуальные 
